ligne,title_1,title_2,text_1,text_2,summary1_text1,summary2_text1,summary1_text2,summary2_text2,Overall,Overall2,nb_entites_idem,nb_lieux_idem,nb_dates_idem,entites_idem,dates_idem,score_similarite_titres,score_similarite_resume1,score_similarite_resume2,score_classif1,score_classif2,score_sentiment1,score_sentiment2,meth1_similarites,meth2_similarites
1925,"L'ancien boxeur Jorge ""La Hiena"" Barrios poignardé à mort à Cordoue - Mirador Virtual Mirador Virtual","L'ancien boxeur Jorge ""La Hiena"" Barrios poignardé à mort à Cordoue","L'ancien champion du monde a été emmené dans un hôpital de Capilla del Monte. Il a subi des blessures par coupure mais est hors de danger. Recherche de l'assaillant

Le boxeur argentin Jorge ""La Hiena"" Barrios a été poignardé tôt ce matin dans une cabane située à Capilla del Monte, province de Cordoba, alors qu'il célébrait le Nouvel An. Le combattant a dû être transporté dans un hôpital de la région en raison des blessures qu'il a subies, bien qu'il soit hors de danger.

Selon la déclaration du propriétaire de Los Olivos, le complexe situé dans le quartier d'El Zapato où l'incident a eu lieu, l'ancien boxeur s'était réuni avec d'autres locataires pour dîner et fêter le début de 2020. Cependant, vers 2 heures, une dispute a éclaté et a conduit à une bagarre. L'une des personnes présentes sur les lieux a pris une lame de 20 centimètres et a poignardé ""La Hiena"" à trois reprises, qui s'est retrouvée avec des blessures à l'un de ses bras et au thorax.

Après la bagarre, l'agresseur a volé un téléphone portable et un portefeuille contenant de l'argent et s'est enfui.

Une ambulance du service EMER de Capilla del Monte a secouru Barrios et l'a emmené immédiatement à l'hôpital municipal Américo Luqui. Ses blessures sont superficielles, mais il sera maintenu en observation aujourd'hui pour éviter toute complication.

""Le patient est en bonne condition. Pour l'instant, il a des blessures coupées, mais sa santé n'est pas compromise. Nous allons prendre de nouvelles images pour observer son évolution, mais en général, il se porte bien"", a déclaré le directeur de l'hôpital, Gerardo Guerra.

Selon les médecins de garde qui l'ont soigné, l'ancien boxeur a déclaré qu'il se trouvait à une fête et qu'il a été agressé. ""Il est arrivé dans l'état logique d'une personne qui vient d'être blessée, mais il était toujours conscient"", ont-ils précisé.

Le boxeur était inactif sur le plan professionnel, compte tenu de la peine qu'il devait purger pour avoir renversé Yamila González en 2010, une jeune femme enceinte de 20 ans qui a perdu la vie dans cette tragédie automobile.

Il a été condamné à 3 ans et 7 mois de prison, plus une interdiction de conduire tout type de véhicule pendant 8 mois, sous les chefs d'accusation d'homicide involontaire et de blessures coupables.

Toutefois, Barrios n'est resté derrière les barreaux que 22 jours, car il a payé une caution de 200 000 pesos pour recouvrer sa liberté. En 2014, il a dû retourner à la prison d'Olmos, où il a terminé sa peine, bien qu'il ait bénéficié d'une libération conditionnelle en 2017.

Finalement, le natif de Tigre a confirmé fin 2018 qu'il allait revenir à la boxe. Le premier combat après sa sortie de prison a eu lieu le 18 décembre de la même année, lorsqu'il a battu le Brésilien Adailton De Jesus, par KO, à Villa de María de Río Seco. Puis, le 16 juin 2019, il a battu Esteban Stodulski de Puntano aux points, dans la ville de Villa Cañás, Santa Fe. Enfin, l'ancien champion du monde des poids super-plumes a battu Diego Chaves à la fin du mois de septembre dernier, lors d'un événement appelé ""Primavera Boxística"", qui s'est tenu à Cordoue.

Reste à savoir si ""La Hiena"", 43 ans, sera capable de se remettre de ce mauvais moment et de remonter sur le ring.

Source : infobae.com

Commentaires

commentaires","Le boxeur argentin Jorge ""La Hiena"" Barrios a été poignardé tôt ce matin à Capilla del Monte. L'incident a eu lieu au 250 rue Hipólito Yrigoyen, sur la route de El Zapato, et le boxeur a dû être transporté dans un hôpital local en raison des coups de couteau qu'il a reçus, bien qu'il soit hors de danger.

""La Hiena"" avait fêté le réveillon du Nouvel An avec des amis dans une cabane de la ville d'El Zapato, où les voisins ont été alertés par les sirènes de la police et des ambulances. La cause de l'incident est encore inconnue, mais les policiers s'efforcent de retrouver l'agresseur.

Une ambulance du service EMER de Capilla del Monte a secouru Barrios et l'a emmené immédiatement à l'hôpital municipal Américo Luqui. Le boxeur a subi des coupures au dos et à la poitrine, mais les blessures étaient superficielles. Cependant, il restera à l'hôpital en observation pour les prochaines heures.

Source : infobae",Argentine : le boxeur Barrios poignardé dans une cabane,"Le boxeur argentin Jorge ""La Hiena"" Barrios a été poignardé tôt ce matin dans une cabane située à Capilla del Monte, province de Cordoba, alors qu'il célébrait le Nouvel An.",Argentine : un boxeur poignardé à El Zapato,"Le boxeur argentin Jorge ""La Hiena"" Barrios a été poignardé tôt ce matin à Capilla del Monte.",1,1.0,4,9,0,"['Capilla', 'Nouvel An', 'del', 'Monte']",[],94.13,80.8,77.09,97.44,8.330000000000002,96.38,29.27,345.8,452.1
1927,Chine - Quelque 400 personnes arrêtées lors d'une nouvelle journée de protestation à Hong Kong,Des dizaines de milliers de Hongkongais défilent le premier jour de 2020,"Quelque 400 manifestants ont été arrêtés dans la nuit de mercredi à jeudi après une nouvelle journée de manifestations de masse à Hong Kong, qui a rassemblé jusqu'à un million de personnes, selon les organisateurs.

La plus grande manifestation s'est déroulée dans le quartier de Causeway Bay, dans le centre de Hong Kong, où le Civil Human Rights Front, les organisateurs de la manifestation, a affirmé qu'il y avait plus d'un million de personnes, un chiffre qui contraste avec les 50 000 personnes signalées par la police, selon le South China Morning Post.

La manifestation convoquée par des organisations pro-démocratie dans le quartier de Causeway Bay était pacifique, jusqu'à ce que les organisateurs annoncent que la police avait donné l'ordre de disperser la marche en raison de quelques incidents violents.

""Le premier jour de 2020, la police a refusé le premier rassemblement autorisé de l'année avec une excuse absurde. Le gouvernement de Hong Kong a démontré son manque de volonté d'écouter les voix des masses en violant le droit de réunion des citoyens"", a dénoncé le Front dans un communiqué.

En conséquence, de nombreux manifestants ont refusé de quitter la zone, ce qui a déclenché l'intervention de la police, qui a chargé, utilisé des gaz lacrymogènes et du gaz poivré et provoqué de graves perturbations. Il a également été rapporté qu'au moins deux cocktails Molotov ont été lancés, mais n'ont pas atteint les officiers.

Suivant la tactique habituelle, les manifestants ont battu en retraite face à l'avancée de la police, puis se sont regroupés et ont affronté la police anti-émeute, qui a chargé depuis deux directions. Des actes de vandalisme ont également été perpétrés contre divers établissements de la région.

Selon la police, au moins 400 personnes ont été arrêtées mercredi, principalement pour rassemblement illégal et possession d'armes offensives, ce qui constitue l'un des plus grands nombres d'arrestations depuis le début des manifestations.

Des sources consultées par le South China Morning Post ont indiqué que la police a changé de stratégie et qu'au lieu de disperser la foule, elle a procédé à des arrestations massives. Les agents ont progressivement repris le contrôle de la zone et mis en place des barrages routiers sur les principales artères, ainsi que des fouilles de bus.

Les manifestations contre le gouvernement de Hong Kong ont commencé il y a plus de six mois à la suite de la décision de faire passer une loi qui aurait permis l'extradition de suspects vers la Chine continentale, mais elles se sont depuis transformées en un mouvement plus large en faveur de la démocratie et contre le pouvoir de Pékin.","MOSCOU (Sputnik) - Des dizaines de milliers de personnes ont défilé dans les rues de Hong Kong pour faire pression sur le chef de l'exécutif Carrie Lam afin qu'il accepte les demandes des manifestants, y compris une enquête indépendante sur le maintien de l'ordre pendant les six mois de manifestations, a rapporté RTHK.

""Nous accueillons 2020 avec une parade. En plus de nous rappeler, ainsi qu'à nos amis internationaux, que nous ne devons pas oublier ni nous habituer à la violence policière et à la répression d'État, nous le faisons également pour exprimer la détermination des Hongkongais à rester solidaires et à marcher ensemble"", a déclaré le Civil Human Rights Front, l'organisateur de la manifestation, sur sa page Facebook.

Dans sa déclaration, l'organisation appelle à ""poursuivre la lutte"" et rappelle que plus de 6 000 personnes ont été arrêtées pendant plusieurs mois de manifestations et que plus de 100 sont toujours en détention.

Les manifestants de Hong Kong ont à nouveau montré leur vrai visage, ils brandissent des drapeaux coloniaux et des bannières portant l'inscription ""HongKong Independence"". Ils crient ""L'indépendance de Hong Kong, la seule issue possible !"" pic.twitter.com",Hong Kong : plus d'un million de manifestants arrêtés,Quelque 400 manifestants ont été arrêtés dans la nuit de mercredi à jeudi après une nouvelle journée de manifestations de masse à Hong Kong.,Des milliers de manifestants à Hong Kong pour faire pression sur le gouvernement Carrie Lam,Des dizaines de milliers de personnes ont défilé dans les rues de Hong Kong pour faire pression sur le chef de l'exécutif afin qu'il accepte les demandes des manifestants.,1,1.0,1,5,0,['Civil Human Rights Front'],[],47.79,75.82,35.35,11.35,9.43,3.7900000000000014,32.7,69.2,116.0
1929,Conservateurs et écologistes s'accordent sur un gouvernement de coalition en Autriche,Kurz reviendra au pouvoir dans le cadre d'un accord de coalition historique qui fera entrer les Verts dans le gouvernement autrichien pour la première fois.,"Le Parti populaire autrichien (ÖVP) et les Verts, écologistes et progressistes, se sont mis d'accord mercredi sur un gouvernement de coalition, dans lequel les deux partis affirment qu'ils défendront leurs priorités respectives : la lutte contre l'immigration légale et la limitation du changement climatique.

""Je suis heureux de vous informer que nous sommes parvenus à un accord"", a annoncé aux médias le chef de l'ÖVP, Sebastian Kurz, qui, avec ce pacte, reprendra son poste de chancelier (chef du gouvernement).

Le leader conservateur a expliqué que les équipes de négociation travailleront encore toute la nuit pour clarifier et se mettre d'accord sur tous les détails afin d'être en mesure de présenter l'accord de gouvernement demain.

Immigration et climat

M. Kurz, qui s'est présenté avec le chef des Verts, Werner Kogler, a reconnu que les négociations, qui ont duré sept semaines, n'ont pas été faciles en raison du fait que les deux partis ""sont très différents dans leurs orientations internes"".

Il a toutefois déclaré qu'un ""excellent résultat"" avait été obtenu et que le ""meilleur des deux mondes"" avait été ""concilié"".

Il a déclaré que les deux partis avaient tenu leurs principales promesses électorales dans leur programme de gouvernement : la lutte contre le changement climatique pour les Verts, la baisse des impôts et la lutte contre l'immigration illégale et l'""islam politique"" pour les Verts.

""Il est possible de réduire la charge fiscale et, en même temps, de rendre le système fiscal écologique. Il est possible de protéger le climat et les frontières"", a-t-il déclaré.

M. Kogler, pour sa part, a insisté sur le fait que le programme du gouvernement comprend des mesures visant à améliorer la transparence de la politique, la situation des plus défavorisés, la lutte contre la pauvreté et une plus grande égalité sociale.

""L'Autriche doit être un précurseur en Europe sur la question de la protection du climat"", a-t-il déclaré.

Bien que l'accord doive être confirmé par les organes du parti vendredi et samedi, M. Kogler a déclaré que le nouveau gouvernement devrait pouvoir commencer à travailler la semaine prochaine.

Répartition inégale des portefeuilles

En attendant la confirmation officielle, le Parti populaire autrichien reprendrait dix ministères, dont certains importants, tels que l'Intérieur, les Affaires étrangères, les Finances et les Affaires européennes.

La défense, également aux mains de l'ÖVP, sera pour la première fois dirigée par une femme.

Les Verts disposeront de la vice-chancellerie, en la personne de Kogler, et d'un ""super-ministère"" de l'environnement et des infrastructures, couvrant l'énergie, la technologie et l'innovation, et dont l'agenda sera axé sur la lutte contre le changement climatique.

Ils géreront également la justice et le portefeuille des affaires sociales et de la santé.

Plus de femmes ministres que d'hommes ministres

Il semble qu'il s'agisse du premier gouvernement autrichien comptant plus de femmes ministres que d'hommes ministres.

Bien que ce soit la première fois que des écologistes siègent au gouvernement central, les Verts font actuellement partie des gouvernements de quatre des neuf Länder autrichiens, dont Vienne. Dans trois d'entre eux, ils font équipe avec l'ÖVP.

Socialement progressistes, par exemple sur les questions d'immigration ou de genre, les Verts disposent d'une base électorale bourgeoise qui peut accepter des pactes avec les conservateurs.

Dans cette répartition inégale des portefeuilles, les conservateurs en récupèrent certains, comme les Affaires étrangères, l'Intérieur et la Défense, qui étaient contrôlés par l'ultra-nationaliste FPÖ pendant les 17 mois de leur coalition, qui s'est terminée en mai par une rupture, une motion de censure et la convocation d'élections anticipées.

Les ultras ont arraché cette part du pouvoir en mettant sur la table les 51 députés qu'ils ont remportés lors des élections d'octobre 2017, soit onze de moins que l'ÖVP et un de moins que le Parti social-démocrate.

Le virage radical de Kurz

Le rapport de force avec les Verts est différent. Non seulement la coalition controversée n'a pas épuisé Kurz, mais son parti a progressé lors des élections de septembre pour atteindre 62 députés sur 183.

Si les Verts ont réussi à réintégrer un parlement dont ils avaient été exclus en 2017, ils ne disposent que de 26 sièges.

Avec ce pacte, Kurz est passé en à peine six mois de gouverner avec un parti xénophobe, euro-critique et nationaliste à siéger avec une formation progressiste et pro-européenne.

En effet, l'homme politique a parfois regretté la rupture de la coalition avec le FPÖ, en raison d'un scandale de corruption impliquant son partenaire, et a reconnu que les différences avec les Verts sont bien plus nombreuses.","Kurz reviendra au pouvoir dans le cadre d'un accord de coalition historique qui fera entrer les Verts dans le gouvernement autrichien pour la première fois.

Le parti populaire autrichien et le parti des Verts ont entamé des négociations sur une éventuelle coalition en novembre.

Le chef du Parti populaire autrichien (ÖVP), Sebastian Kurz, a conclu un accord de coalition avec les Verts pour assurer son retour au pouvoir. Cela permettra au parti écologiste de centre-gauche de rejoindre le gouvernement national pour la première fois.

Kurz et le leader des Verts, Werner Kogler, ont annoncé cet accord le 1er janvier. Tous deux ont déclaré qu'ils étaient fiers d'avoir pu tenir les ""principales promesses de campagne"".

""Nous nous sommes davantage entendus sur la protection du climat que nous ne le soupçonnions"", a déclaré M. Kogler, ajoutant que ""l'écologisation et l'équilibre social vont de pair"".

M. Kurz a déclaré que le programme de la nouvelle coalition gouvernementale serait présenté jeudi. La décision doit encore être approuvée par une majorité de délégués lors du congrès fédéral du parti vert, samedi. S'il est approuvé, le nouveau gouvernement pourrait prendre le pouvoir dès la semaine prochaine.

Le leader de l'ÖVP a été démis de ses fonctions en mai de l'année dernière, en même temps que l'ensemble de son gouvernement de coalition, formé avec le parti d'extrême droite FPÖ, lors d'une destitution historique faisant suite à une motion de défiance suscitée par des allégations de corruption à l'encontre du président de l'extrême droite, Heinz-Christian Strache.

M. Kurz a entamé des négociations avec les Verts en novembre, deux mois après que les deux partis aient obtenu de bons résultats aux élections législatives anticipées de septembre. Après la victoire de son parti aux élections, il a reçu le mandat de former un nouveau cabinet.

Auparavant, M. Kurz avait prévenu qu'il ne serait pas facile pour les partis conservateur et progressiste de trouver un terrain d'entente, étant donné leurs positions très divergentes sur des questions telles que l'immigration et la politique économique. Pour sa part, le leader des Verts a déclaré que les deux forces politiques ont été élues dans les urnes pour assumer la responsabilité de l'avenir de l'Autriche.

Si vous l'avez aimé, partagez-le avec vos amis !",Autriche : les Verts et les Verts se mettent d'accord sur un gouvernement de coalition,"Le Parti populaire autrichien (ÖVP) et les Verts, écologistes et progressistes, se sont mis d'accord mercredi sur un gouvernement de coalition, dans lequel les deux partis affirment qu'ils défendront leurs priorités respectives.",Élections en Autriche : les Verts entrent au gouvernement pour la première fois,"Le chef du Parti populaire autrichien (ÖVP), Sebastian Kurz, a conclu un accord de coalition avec les Verts pour assurer son retour au pouvoir.",1,1.0,18,1,0,"['les Verts', 'Kogler', 'Sebastian', 'Verts', 'Parti populaire', 'M.', 'Parti populaire autrichien', 'Werner', 'FPÖ', 'Kurz', 'ÖVP']",[],76.35,73.89,77.25,56.07,9.11,99.15,21.36,390.5,374.4
1936,Plusieurs animaux tués dans un zoo allemand après un incendie provoqué par des lumières de Noël,Plus de 30 animaux tués dans l'incendie d'un zoo allemand,"Des lanternes volantes sont la cause la plus probable d'un incendie dans un zoo de la ville de Krefeld, dans l'ouest de l'Allemagne, qui a tué une trentaine d'animaux dans l'enclos des singes la nuit dernière, dont cinq orangs-outans, deux gorilles et un chimpanzé, a déclaré la police mercredi.

Lors d'une conférence de presse, le chef de la police judiciaire de Krefeld, Gerd Hoppmann, a déclaré qu'une enquête pour incendie criminel avait été ouverte après la découverte, dans la zone proche de l'incendie, de trois lanternes volantes de 34 centimètres de diamètre contenant des messages manuscrits de vœux pour la nouvelle année.

Il a ajouté que des témoins ont déclaré avoir vu de tels objets cylindriques, faits de papier de soie, avec une bougie ou une pâte combustible à l'intérieur qui produit de la chaleur et la fait s'élever, dans l'air à une très basse altitude peu avant que le feu ne se déclare sur le toit de l'enclos des singes. Il a rappelé que depuis 2009, il est interdit de faire exploser de tels engins tant dans le Land de Rhénanie-du-Nord-Westphalie, où s'est produite la tragédie, que dans toute l'Allemagne, à l'exception du Mecklembourg-Poméranie occidentale.

Dans le même temps, il a appelé les témoins éventuels et les personnes qui les ont fait exploser à se manifester, ""car cela ne peut qu'améliorer leur situation"", a-t-il déclaré.

Le directeur du zoo de Krefeld, Wolfgang Dressen, a déclaré que le feu avait tué cinq orangs-outans de Bornéo, un chimpanzé d'Afrique de l'Ouest et deux gorilles des plaines occidentales, ainsi que des primates plus petits, d'autres mammifères et des oiseaux.

Il a qualifié de ""quasi-miracle"" le fait que deux chimpanzés aient survécu avec des brûlures mineures à cet ""incendie monstrueux"", qui, grâce aux efforts des pompiers, ne s'est pas propagé aux jardins des gorilles et à l'enclos des kangourous adjacents. Il a notamment évoqué la mort de Massa, 45 ans, le plus vieux gorille d'Europe, qu'il a dit avoir vu vieillir et dont il a dit qu'il était un ""homme sénile mais digne"".

Il a fait allusion à l'énorme effort qu'il faudra fournir pour surmonter cette tragédie, en particulier pour les gardiens, qui avaient un ""lien émotionnel"" avec les animaux. Il a rappelé que les trois familles de singes sont des espèces menacées et a souligné l'intention du zoo, pionnier en Europe, a-t-il dit, avec son enclos tropical pour singes, inauguré en 1975, de continuer à concentrer ses efforts pour contribuer à la protection de ces animaux.

Le porte-parole des pompiers de Krefeld, Kai Günther, a déclaré que dès que les pompiers sont arrivés sur le lieu de l'incendie, il était clair qu'""il n'y avait plus rien à sauver"", et que la découverte de deux chimpanzés vivants a donc été une surprise. Il a également souligné que l'enceinte n'était pas équipée de détecteurs d'incendie, qui n'étaient pas non plus prévus, car techniquement, ils auraient souvent déclenché de fausses alarmes en raison de la grande accumulation de poussière sur le site.

M. Dressen a souligné que le feu s'est propagé si rapidement que même si des détecteurs d'incendie avaient été en place, les pompiers n'auraient pas pu se rendre sur les lieux beaucoup plus tôt pour éteindre les flammes. En ce qui concerne la reconstruction du zoo, le directeur du zoo s'est dit favorable à l'installation de détecteurs d'incendie, dont il espère qu'ils ne poseront pas de problème technique dans un bâtiment plus moderne.

Il n'est pas en mesure de chiffrer les dégâts matériels, mais il est convaincu que la reconstruction de l'enceinte de 2 000 mètres carrés ne coûtera pas seulement les deux millions de marks (un million d'euros) de 1975, mais des dizaines de millions d'euros.","BERLIN - Un incendie survenu dans un zoo de l'ouest de l'Allemagne dans les premières minutes de 2020 a tué plus de 30 animaux, dont des singes, des chauves-souris et des oiseaux, ont indiqué les autorités mercredi. Des lanternes volantes lancées pour célébrer le Nouvel An pourraient être à l'origine de l'incendie, a ajouté la police.

Plusieurs témoins ont déclaré avoir vu les lanternes - des cylindres de papier avec une petite flamme pour chauffer l'air de la lanterne, qui vole dans le ciel nocturne - peu après minuit mercredi près du zoo de Krefeld, a déclaré à la presse Gerd Hoppmann, chef de la police criminelle de la ville.

""Les gens ont rapporté avoir vu ces lanternes voler à basse altitude près du zoo, puis elles ont commencé à prendre feu"", a déclaré Hoppmann.

Les lanternes volantes, également connues sous le nom de lanternes chinoises, sont une sorte de montgolfière en papier. Ils sont utilisés pour les festivités en Asie depuis des siècles.

La police et les pompiers ont reçu les premiers appels à 12h38.

Le zoo, situé près de la frontière néerlandaise, a déclaré que toute la maison des singes avait pris feu et que plus de 30 animaux étaient morts, dont cinq orangs-outans, deux gorilles, un chimpanzé et plusieurs singes, ainsi que des chauves-souris et des oiseaux.

Les pompiers n'ont pu sauver des flammes que deux chimpanzés, qui ont subi des brûlures mais dont l'état est stable, a déclaré le directeur du zoo, Wolfgang Dressen.

""C'est presque un miracle que Bally, un chimpanzé de 40 ans, et Limbo, un mâle plus jeune, aient survécu à ce brasier"", a déclaré M. Dressen. Il a ajouté que de nombreux soigneurs d'animaux ont été choqués par la dévastation.

M. Hoppmann a signalé que l'utilisation de torches volantes est illégale à Krefeld et dans la majeure partie de l'Allemagne et a demandé que les personnes qui les ont lancées ou qui les ont vues se rendent à la police.

Le zoo de Krefeld a ouvert en 1975 et attire environ 400 000 visiteurs chaque année. Il restera fermé mercredi.",Incendie dans un zoo en Allemagne : des lanternes volantes sont la cause la plus probable d'un incendie,"Trois millions d'euros d'efforts de sauvetage ont été nécessaires pour sauver des dizaines de milliers d'animaux de plus, mais les pompiers n'ont pas permis de les repérer et de les réparer.",Allemagne : 30 animaux tués par un incendie au zoo de Krefeld,"Un incendie survenu dans un zoo de l'ouest de l'Allemagne a tué plus de 30 animaux, dont des singes, des chauves-souris et des oiseaux.",1,1.0,5,7,0,"['M.', 'Hoppmann', 'Dressen', 'Gerd', 'Wolfgang']",[],64.02,50.82,30.5,88.38000000000002,8.34,4.09,25.129999999999995,411.3,285.7
