ligne,title_1,title_2,text_1,text_2,summary1_text1,summary2_text1,summary1_text2,summary2_text2,Overall,Overall2,nb_entites_idem,nb_lieux_idem,nb_dates_idem,entites_idem,dates_idem,score_similarite_titres,score_similarite_resume1,score_similarite_resume2,score_classif1,score_classif2,score_sentiment1,score_sentiment2,meth1_similarites,meth2_similarites
2317,L'euphorie du marché résistera-t-elle au coronavirus ?,"De nombreux médecins toujours sans masques, malgré les promesses de l'Etat","Le cap du million de ventes a été dépassé l'an dernier. L'empressement des acheteurs à devenir propriétaires, doublé d'une pénurie de biens à vendre, a entraîné de fortes hausses de prix dans certaines villes. L'euphorie ne semblait pas devoir retomber... Mais la crise actuelle risque de changer la donne.

Record battu ! En 2019, contre toute attente, le nombre de transactions a franchi pour la première fois, en France, le cap du million, avec 1 059 000 ventes enregistrées sur tout le territoire. Cette excellente conjoncture est surtout due aux taux de crédit historiquement bas, qui ont contribué à doper le pouvoir d'achat des acheteurs. ""En moyenne, les ménages ont pu emprunter à des taux compris entre 1,1 et 1,2% l'an dernier, soit moins que l'inflation "", confirme Philippe Taboret, directeur associé du courtier Cafpi. Mais les particuliers ont aussi été nettement plus nombreux à s'intéresser à l'investissement locatif. L'an passé près d'une transaction sur quatre a été réalisée dans cet objectif. La raison : beaucoup de ménages voulaient garantir une stabilité à leur patrimoine et profiter d'une rentabilité moyenne de 2 à 5%. Des taux largement plus intéressants que ceux offerts par les produits financiers à risque modéré.

Mais face à cette demande en forte hausse, le nombre de vendeurs a continué de diminuer dans les zones les plus recherchées. A Paris, la pénurie qui frappe le marché depuis plus de deux ans s'est accentuée. Le prix du mètre carré dans la capitale a donc flambé, avec une hausse de 6,2% en moyenne l'an dernier selon les notaires. La barre psychologique des 10 000 €/m2 a même été dépassée, sans que l'appétit des acheteurs s'émousse. Le phénomène d'attraction de la capitale a aussi été constaté dans le haut de gamme. ""L'an dernier, nous avons noté beaucoup plus de transactions entre 3 et 7 millions d'euros qu'en 2018"", confie Alexander Kraft, président-directeur général de Sotheby's Realty France-Monaco. Phénomène nouveau : la frénésie immobilière s'est largement diffusée dans toutes les grandes métropoles de Province, avec les mêmes conséquences. ""De mois en mois, le manque de biens à vendre s'accentue dans tous les quartiers de l'hypercentre et leur proche couronne "", observe Philippe Descampiaux, directeur des agences Descampiaux-Dudicourt à Lille.","Stocks réduits ou distribués au ""compte-gouttes"", les soignants français manquent toujours de masques dans leur lutte contre le coronavrius. Ils bénéficient de dons de particuliers en attendant les livraisons.

Pour les soignants le problème reste entier. Le personnel médical en France fait toujours face à un manque criant de masque de protection face au Covid-19. La semaine dernière le sujet a pris l'ampleur d'une polémique tant les médecins, en première ligne dans la lutte contre l'épidémie de coronavirus, manquaient de cet objet devenu emblématique de la crise sanitaire que traverse le pays et alors que les premiers soignants sont morts du coronavirus ces derniers jours.

Samedi dernier, le ministre de la Santé affirmé que les autorités avaient commandé ""250 millions de masques"", qui seront livrés ""progressivement"" dans les jours qui viennent. A l'heure actuelle, il y a un ""stock d'État"" de 86 millions d'unités, dont 5 millions de masques FFP2 plus protecteurs, le reste étant des masques chirurgicaux, a rappelé le ministre de la Santé. Il ajoutait : ""nous prévoyons une consommation de 24 millions de masques par semaine"", priorité sera donnée pour ces masques aux personnels de santé en ville comme à l'hôpital et aux personnes intervenant auprès des personnes âgées.",Immobilier : le cap du million de ventes dépassé en 2019,"L'empressement des acheteurs à devenir propriétaires, doublé d'une pénurie de biens à vendre, a entraîné de fortes hausses de prix dans certaines villes.",Coronavirus : les soignants manquent toujours de masques,Les soignants français manquent toujours de masques dans leur lutte contre le coronavrius. Ils bénéficient de dons de particuliers en attendant les livraisons.,3,3.0,0,2,0,[],[],11.36,-5.91,6.86,5.9,8.420000000000002,0.04,28.06,164.8,249.0
2318,Clarenceville: Alexandre et Ilana Dupont n’iront pas aux Jeux paralympiques,COVID-19 : le fédéral donnera 2 000 $ par mois aux travailleurs mis à pied,"SPORTS – La majorité des activités sportives de la planète ont été suspendues en raison de la pandémie de coronavirus. Si l’incertitude plane encore quant à la tenue des Jeux paralympiques qui doivent se dérouler du 25 août au 6 septembre, à Tokyo, au Japon, le Canada a décidé qu’il n’enverrait pas ses athlètes au cours de l’été 2020.

Le Comité olympique canadien et le Comité paralympique canadien en ont fait l’annonce le 22 mars, en soirée.

«Cette décision ne relève pas uniquement de la santé des athlètes, c’est une question de santé publique, indique le Comité olympique canadien, par voie de communiqué. Dans le contexte actuel de la COVID-19 et des risques qui y sont associés, il n’est pas sain pour nos athlètes ni pour la santé et la sécurité de leurs familles et de la population canadienne en général de poursuivre l’entraînement en préparation pour ces Jeux. Cela irait même à l’encontre des avis de santé publique que nous demandons à tous les Canadiens de suivre.»

Jusqu’à ce que cette nouvelle tombe, Alexandre et Ilana Dupont, deux coureurs en fauteuil roulant de Saint-Georges-de-Clarenceville, continuaient de s’entraîner, sans savoir s’ils auraient l’opportunité de s’y rendre.

«On n’en sait pas plus que vous, expliquait M. Dupont quelques jours avant cette annonce. Ça va mal à la shop! Toutes nos épreuves de qualification ont été annulées.»

Parmi ces épreuves, on compte un camp d’entraînement qui devait se tenir à Daytona, aux États-Unis, à la mi-mars, ainsi que deux importantes compétitions qui devaient se dérouler en avril, à Phoenix, en Arizona, et à Dubaï, aux Émirats arabes unis. Tous ces événements ont été annulés.

C’est important les Jeux, mais la vie aussi! -Alexandre Dupont

«Au mois de janvier, on avait un camp d’entraînement et une compétition en Australie, mais ç’a avait été annulé parce que le continent brûlait, rappelle M. Dupont. Notre plus grosse compétition devait avoir lieu en Suisse, au mois de mai, et elle vient d’être annulée.»

Entraînement

Alexandre et Ilana Dupont possède tout l’équipement nécessaire pour s’entraîner à la maison. Ils poursuivaient leur programme d’entraînement, en attendant une décision à savoir si les Jeux allaient être reportés ou même annulés.

«On est chanceux parce qu’on a un gym dans notre sous-sol, explique l’athlète. Notre entraînement n’a pas changé. La plupart des autres athlètes s’entraînaient dans les gyms et au centre d’entraînement national, à Montréal. Maintenant que ces endroits sont fermés, tout le monde est pris chez eux et ils lèvent des cannes de bines.»

«Tout le monde est dans le même bateau, partout dans le monde, ajoute M. Dupont. Moi aussi je veux y aller aux Jeux, mais il faut en revenir. J’aime ça aller vite et tourner en rond sur une piste, mais pas à tout prix.»

«Bravo Canada… parfois, il faut [se démarquer] et être le premier à prendre une décision incroyablement difficile. Aussi dur que ce soit, je suis tout à fait d’accord avec cette décision», a commenté Ilana Dupont sur sa page Facebook, au lendemain de la décision prise par le Comité olympique canadien.","Cette nuit, la Chambre des communes a adopté le projet de loi de 82 G$ d’aide d’urgence aux Canadiens. Dans ce plan, on retrouve entre autres la nouvelle prestation canadienne d’urgence qui viendra appuyer tous les travailleurs mis à pied.

Durant les 4 mois à venir, les travailleurs qui ont perdu leur emploi à cause de la COVID-19, qu’ils soient à temps plein, à temps partiel, à contrat ou travailleur autonome auront le droit de recevoir 2 000 $ chaque mois. De plus, les personnes malades, en quarantaine, qui prennent soin de quelqu’un atteint de la COVID-19, d’enfants ou d’aînés auront accès également à cette aide. Le gouvernement canadien ajoute à cela ceux qui ont toujours leur emploi, mais qui ne reçoivent aucun salaire.

Un portail en ligne sera fonctionnel dans les prochains jours et les demandeurs devraient recevoir le premier montant 10 jours après la demande.

Dans l’aide direct aux Canadiens on trouvera aussi une bonification de l’allocation canadienne pour enfant et un gèle des remboursements des prêts étudiants pendant 6 mois.

« La semaine dernière près d’un million de personnes a demandé l’assurance-emploi. La vérité difficile c’est que les gens sont dans la rue à cause de ce virus et se préoccupent de l’avenir. J’aimerai que vous sachiez que nous serons-là, vous pouvez compter sur nous », premier ministre du Canada, Justin Trudeau.

Assurance-emploi

Le premier ministre indique que ceux ayant fait une demande auprès de l’assurance-emploi devraient recevoir le premier chèque autour de Pâques. Il est possible également pour ceux qui normalement n’ont pas le droit à cette aide de faire la demande.

Situation actuelle au Canada

Ce matin, on dénombrait à travers le pays 2 892 cas confirmés, 28 morts et 186 rétablis.",Coronavirus : le Canada n'enverrait pas ses athlètes aux Jeux paralympiques,"La majorité des activités sportives de la planète ont été suspendues en raison de la pandémie de coronavirus. Si l'incertitude plane encore quant à la tenue des Jeux paralympiques, le Canada a décidé qu'il n'enverrait pas ses athlètes au cours de l'année 2020.",Canada : 82 G d'aide d'urgence pour les Canadiens,"Cette nuit, la Chambre des communes a adopté le projet de loi de loi de 82$ d'aide d'urgence aux Canadiens.",4,4.0,0,4,0,[],[],2.75,24.51,13.03,0.1,9.02,99.92,31.29000000000001,160.8,84.6
2319,Deux retraités matanais sont coincés en Équateur,"L'opération de rapatriement est un «fiasco», dénoncent des Québécois coincés au Pérou","Deux Matanais, Hélène Gagnon et Clarence Bouffard, font partie de la centaine de Canadiens, principalement des Québécois, coincés en Équateur.

Les deux ont une santé fragile et ont entamé en vain diverses démarches depuis la mi-mars pour rentrer au pays. D'autres voyageurs dont plusieurs retraités originaires de la Gaspésie, de la Mauricie, du Saguenay-Lac-Saint-Jean, de Québec et de Montréal, sont dans cette situation.

Hélène Gagnon et Clarence Bouffard, tous deux âgés de plus de 70 ans, s’étaient installés pour passer une partie de l’hiver sur la côte ouest de l’Équateur, dans un complexe résidentiel, Mirador San José, qui appartient à des intérêts canadiens.

Les Matanais ont joué de malchance.

Retour perturbé par la COVID-19

C’était leur deuxième voyage en Équateur. Le site de vacances où ils se sont installés, dans la province de Manabi, a subi une longue panne d’électricité de trois semaines et a aussi manqué d’eau. Exaspéré, le couple avait devancé son retour de trois semaines.

Ils devaient rentrer au pays le 17 mars, mais les obstacles se sont multipliés avec les mesures mises en place par l’Équateur pour contrer la propagation de la COVID-19.

Le pays a interdit la circulation entre les provinces et fermé ses frontières le 16 mars à 23 h 59.

Le vol que le couple devait prendre entre Guayaquil et Panama a été annulé. Depuis ce temps, on a réessayé de partir, mais les vols partent de Quito, et c’est à environ huit à neuf heures de trajet en auto , explique Hélène Gagnon.

Circulation limitée

Deux vols d’Air Canada de Quito vers Toronto, l'un prévu mercredi et l'autre vendredi, ont effectivement été organisés pour rapatrier les Canadiens.

Toutefois, la circulation entre les provinces, même munis d’un laissez-passer de l'ambassade du Canada semble toujours extrêmement difficile.

Un extrait d'un message envoyé aux ressortissants canadiens toujours coincés en Équateur. Photo : Radio-Canada / Joane Bérubé

Des connaissances du couple, munies d’une autorisation de déplacement ont tenté mardi de se rendre dans la capitale pour prendre le vol Quito-Toronto.

Ils ont dû rebrousser chemin, après avoir déboursé en vain 2400 $ pour leur billet de retour et plusieurs centaines de dollars pour leur transport jusqu’à Quito.

D’autres n’ont pas pu réserver à temps, puisque les deux vols ont affiché rapidement complet.

Un espoir?

Le groupe de Québécois demande au gouvernement canadien d’organiser un vol à partir des villes de Guayaquil ou de Manta, ou un transport par autobus jusqu’à Quito si le vol part de là-bas.

Carte qui recense les endroits où se trouvent des Canadiens en Équateur. Photo : Gracieuseté Annie Perreault

Selon l’agente de voyage, Annie Perreault qui tente d’aider des voyageurs coincés en Équateur, deux autres vols seront disponibles les 29 et 31 mars.

Un autobus sera possiblement disponible pour transporter des passagers de la ville de Manta, près de Mirardor San José, vers Quito.

Pour plusieurs Québécois âgés comme Hélène Gagnon et son mari, le voyage de retour risque d’être très épuisant.

Après huit à dix heures de route, ils devront prendre un vol de nuit à l’aéroport de Quito, puis attendre un autre vol pour Montréal pour ensuite se rendre à Matane, à six heures de voiture.

Nous ne pouvons arrêter nulle part à cause de la quarantaine. C’est insensé Hélène Gagnon

Mme Gagnon souhaiterait attendre un vol vers Montréal.

En attendant, Hélène Gagnon et Clarence Bouffard peuvent se rendre à l’épicerie, de manière limitée, et ont pu faire quelques provisions. Un couvre-feu, qui débute maintenant en après-midi, a aussi été imposé.

L’Équateur comptait, le 25 mars, 1173 cas de personnes infectées au coronavirus.","Sarah Mahu est coincée au Pérou. Elle a réussi à trouver une chambre dans une auberge de jeunesse de Lima, qui peut fermer d’un jour à l’autre.

Des Québécois coincés au Pérou qualifient de « fiasco » l’opération de rapatriement menée par Ottawa : vols surchargés, codes erronés, coût exorbitant…

Suzanne Colpron

La Presse

« Le Canada est beaucoup plus lent que tous les autres pays », affirme Xavier Berthiaume, qui se trouve à Cuzco, une ville de la cordillère des Andes, à 20 heures de route de la capitale Lima.

« Deux jours après la déclaration de l’état d’urgence, les Espagnols, les Argentins, les Israéliens, les Uruguayens et les Chiliens ont été rapatriés chez eux. Mais nous, on est en retard d’une semaine sur tout le monde. »

Ottawa a nolisé trois vols cette semaine pour ramener les Canadiens qui sont au Pérou. Le premier a décollé mardi de Lima vers Toronto. Les deux autres doivent partir jeudi et vendredi. Mais les billets, vendus 1400 $, partent vite et les gens qui ne sont pas dans la capitale n’ont aucun moyen de s’y rendre. Les routes sont bloquées et les avions n’ont pas l’autorisation de décoller.

Xavier Berthiaume s’estime chanceux. Il a trouvé un appartement où loger. « Je ne suis pas trop à plaindre. J’ai tout ce dont j’ai besoin, même si je n’ai pas le droit de prendre une marche. Je peux aller à l’épicerie et à la pharmacie. »

Des armes de guerre

D’autres, comme Béatrice Dauphinais et son copain Cyril Mignotet, n’ont pas la même chance.

Dimanche soir, vers 21 h, la police péruvienne a fait irruption dans l’hôtel qu’ils occupent à Cuzco. Une quarantaine de Canadiens, le dos contre le mur, ont été photographiés et filmés.

Des agents des forces spéciales, « équipés d’armes de guerre », les ont conduits au poste, où ils ont été fouillés et interrogés pendant quatre heures. Raison invoquée : rassemblement illégal.

« On était dans la cuisine de l’hôtel en train de faire la vaisselle, explique Béatrice Dauphinais. Ç’a été un moment hyper angoissant parce qu’on ne savait pas ce qu’ils allaient faire de nous. »

PHOTO FOURNIE PAR BÉATRICE DAUPHINAIS ET CYRIL MIGNOTET Béatrice Dauphinais et Cyril Mignotet

Béatrice Dauphinais et son copain ont tenté de devancer leur retour au Canada quand l’épidémie due au coronavirus a pris de l’ampleur. Mais, comme des centaines d’autres, ils n’ont pas réussi à réserver un billet d’avion à temps.

« Ici, on ne sait pas ce qui va nous arriver, dit Béatrice. Notre hôtel peut fermer demain. La plupart ont fermé faute de clients. On peut se retrouver à la rue et se faire contaminer. On craint vraiment pour notre sécurité. »

Panique à bord

Sarah Mahu, elle, est à Lima. Ça faisait une semaine qu’elle était arrivée au Pérou quand l’état d’urgence a été déclaré.

Elle a acheté un billet d’avion pour Montréal qui passait par le Panamá et les États-Unis. Mais son vol Arequipa-Lima a été annulé à la dernière minute. Au même moment, le président du Pérou, Martin Vizcarra, ordonnait la fermeture des frontières. Couvre-feu de 20 h à 5 h et pas d’attroupements sous peine d’amende ou de prison.

« Vous imaginez la panique à bord ! lance-t-elle. C’était la course contre la montre. J’ai acheté un billet pour un autre vol qui partait le lendemain matin. Ce vol est parti, mais je suis restée coincée à l’aéroport de Lima. J’ai essayé de passer par tous les pays pour rentrer, le Chili, l’Argentine, les États-Unis… Mais les sites étaient bloqués et les prix étaient fous : de 2000 $ à 4000 $. À la fin de la journée, j’ai même vu des billets à 10 000 $. »

Quand elle a compris qu’il n’y avait rien à faire, Sarah Mahu a déniché une chambre dans une auberge de jeunesse de Lima, qui peut fermer d’un jour à l’autre.

Mal organisé

Elle avait « plein d’espoir » quand le Canada a annoncé l’envoi de trois avions pour rapatrier ses ressortissants. « C’est un beau fiasco, dit-elle. J’ai reçu un code à 17 h [lundi], mais je n’ai pas pu réserver quoi que ce soit. Tout le monde avait le même code. Est-ce que le vol était surbooké ? Je ne sais pas, mais j’ai trouvé ça un peu mal fait. On est trop nombreux pour les trois vols, c’est ça qui fait peur. »

« C’est tout à fait mal organisé, ajoute Xavier Berthiaume. Cette opération a l’air improvisée du début à la fin. En plus, les billets sont très chers : 1400 $ pour un aller simple, c’est beaucoup d’argent. J’ai payé 650 $ pour un aller-retour. »

Aux dernières nouvelles, plus de 2500 Canadiens au Pérou attendent d’être rapatriés au pays.

Pas mieux en Équateur

En Équateur, des Canadiens sont aussi inquiets et se demandent quand ils vont pouvoir rentrer au Canada. « Tous les vols intérieurs et internationaux sont interdits depuis le 16 mars », affirme Annie Perreault, qui a contacté La Presse pour nous alerter sur le sort de Québécois coincés à Manta et à Guayaquil, à 12 heures de voiture de la capitale, Quito, d’où décollent les avions nolisés par Ottawa. « L’ambassade a obtenu des passes “salvoconducto” du gouvernement équatorien pour permettre aux gens de franchir les barrages policiers, mais on ne les a pas laissé passer », ajoute Mme Perreault. Un groupe de 108 Québécois est coincé dans cette région. « Les gens sont inquiets. Ils n’ont pas le droit de sortir et ils commencent à manquer de nourriture. »",Coronavirus : des Canadiens coincés en Équateur attendent désespérément un vol,"Un couple de Québécois, coincés en Équateur, a dû renoncer à se rendre en Belgique pour se rendre en Belgique.",Coronavirus : des Québécois coincés au Pérou qualifient de « fiasco » l'opération de rapatriement,"Un mois après la proclamation de l'état d'urgence, les autorités péruviennes ont rapatrié les citoyens coincés dans le pays. Reportage.",2,2.0,2,16,0,"['Annie', 'Perreault']",[],25.75,58.94,23.69,34.849999999999994,8.48,98.21,25.930000000000003,136.0,234.2
2320,Coronavirus : le musicien et chanteur camerounais Manu Dibango est décédé,"L'Afrique pleure Manu Dibango, victime du coronavirus (Autre presse)","Atteint par le covid-19, l’artiste camerounais Manu Dibango est mort mardi matin des suites de la maladie, à l’âge de 86 ans. La famille du chanteur et saxophoniste a annoncé,…

Coronavirus : le musicien et chanteur camerounais Manu Dibango est décédé

Atteint par le covid-19, l’artiste camerounais Manu Dibango est mort mardi matin des suites de la maladie, à l’âge de 86 ans.

La famille du chanteur et saxophoniste a annoncé, mardi 24 mars, son décès des suites du Covid-19, la maladie provoquée par le coronavirus. » « Chers parents, chers amis, chers fans, une voix s’élève au lointain… c’est avec une profonde tristesse que nous vous annonçons la disparition de Manu Dibango, notre Papy Groove, survenue le 24 mars 2020 à l’âge de 86 ans, des suites du covid 19 », a déclaré Thierry Durepaire, gérant des éditions musicales de l’artiste camerounais.

Le 18 mars, la contamination de l’artiste avait été annoncée sur sa page Facebook. « Les obsèques auront lieu dans la stricte intimité familiale, et un hommage lui sera rendu ultérieurement dès que possible », indique la famille dans son communiqué.

Manu Dibango, saxophoniste et légende de l’afro-jazz, auteur d’un des plus grands tubes planétaires de la musique world, « Soul Makossa » (1972), est la deuxième célébrité à décéder des suites d’une contamination au Coronavirus après Aurlus Mabélé. « Il est décédé au petit matin, dans un hôpital de la région parisienne », a indiqué M. Durepaire à l’AFP.","L'Afrique pleure Manu Dibango, victime du coronavirus (Autre presse) [ALomé] - 25/03/2020 En l'espace de quelques jours, deux piliers de la musique du continent, Manu Dibango et Aurlus Mabélé, sont morts des suites du Coronavirus (Covid-19). La mort de l'icône camerounaise du Jazz, Emmanuel N'Djoké Dibango, plus connu sous Manu Dibango, et celle de la légende congolaise du soukouss, (...) ... lisez l'article dans ALomé

Tweeter

Le Togo dans les journaux africains

Togo : Faure Gnassingbé, 15 ans d’impéritie « Existe-t-il pour l’homme un bien plus précieux que la Santé ? » (Socrate) Quand on a de la vision pour son pays, quand on l’aime véritablement, on (...) 27avril 24/03/2020

Sécurité alimentaire : l’ANSAT ouvre les opérations de vente des produits céréaliers Ouverture des opérations de vente des produits céréaliers par l’ANSAT au Togo Cet article Sécurité alimentaire : l’ANSAT ouvre les opérations de vente (...) La voix de la nation 24/03/2020

Gabon : Encore une attaque pirate au large de Libreville L'entreprise de transport maritime MSC rapporte qu'un de ses bateaux dénommé ''TALIA'' aurait été attaqué dans la nuit du samedi 21 au dimanche 22 (...) Infos Gabon 24/03/2020

Coronavirus/Bilan ce 25 mars 2020: La flèche reste ascendante, trois nouveaux cas portent le nombre d'infectés à 23 (...) De 20 cas hier mardi dont un guéri et 19 cas actifs, le curseur a encore bougé ces dernières 24 heures. Ainsi, selon les chiffres du gouvernement, (...) ALomé 25/03/2020

Des Togolais testés positifs au Liban 304 personnes sont atteintes du coronavirus au Liban. La population a été placée en confinement total depuis plusieurs (...) République Togolaise 25/03/2020",Coronavirus : le chanteur et chanteur camerounais Manu Dibango est décédé,"Atteint par le covid-19, l'artiste camerounais est mort mardi matin des suites de la maladie, à l'âge de 86 ans.",Coronavirus : l'Afrique pleure Manu Dibango victime du coronavirus,"En l'espace de quelques jours, deux piliers de la musique du continent sont morts des suites du coronavirus.",1,1.0,8,0,0,"['Dibango', 'Aurlus', 'Manu', 'Mabélé']",[],77.88,78.52,53.12,35.050000000000004,9.029999999999998,99.62,30.55,148.4,134.8
