ligne,title_1,title_2,text_1,text_2,summary1_text1,summary2_text1,summary1_text2,summary2_text2,Overall,Overall2,nb_entites_idem,nb_lieux_idem,nb_dates_idem,entites_idem,dates_idem,score_similarite_titres,score_similarite_resume1,score_similarite_resume2,score_classif1,score_classif2,score_sentiment1,score_sentiment2,meth1_similarites,meth2_similarites
3455,Coronavirus. L’ARS annonce 15 nouveaux contaminés en Nouvelle-Aquitaine,5 nouveaux cas de coronavirus en Charente-Maritime ce week-end,"L’Agence Régionale de Santé annonce, dans son point journalier ce mardi 10 mars 2020, 15 nouvelles contaminations au coronavirus en Nouvelle-Aquitaine. Le chiffre pointe désormais à 55 cas dans la région, contre 40 lundi 9 mars 2020.

Lire aussi : Coronavirus : l’ARS dénombre 11 nouvelles contaminations en Nouvelle-Aquitaine ce lundi

Le Lot-et-Garonne est le département le plus touché, avec sept nouveaux cas. Six autres ont été détectés en Charente-Maritime, un dans la Vienne et un autre en Gironde.

Les infos en direct

L’ARS met à disposition tous les jours, le midi, un tableau des nouveaux cas de contamination.

[#COVID2019] Point de situation au 10 mars :

📍 15 nouveaux cas confirmés de #coronavirus en Nouvelle-Aquitaine

👉 Le suivi des cas confirmés en Nouvelle-Aquitaine sur : https://t.co/6KymWxH9RP

👉 Des précisions sur ces cas confirmés seront apportées dans l'après-midi — ARS Nouvelle-Aquitaine (@ARS_NAquit) March 10, 2020

Les bons gestes à adopter

Des gestes simples doivent être adoptés pour préserver sa santé et celle de son entourage : se laver les mains très régulièrement, tousser ou éternuer dans son coude, saluer sans se serrer la main, éviter les embrassades, utiliser des mouchoirs à usage unique.","5 nouveaux cas de coronavirus ont été confirmés en Charente-Maritime. Un couple en lien avec un cas recensé en Occitanie et trois personnes en contact avec autre patient infecté déjà connu précise l'Agence Régionale de Santé.

5 nouvelles personnes infectées par le coronavirus en Charente-Maritime ce week-end. L'origine de leur contamination est connue. Il y a un couple en lien avec un cas identifié en Occitanie et trois personnes qui ont fréquenté un patient infecté déjà connu de l'Agence Régionale de Santé. L'ARS qui ne précise pas l'état de santé de ces cinq malades ni s'ils ont dû être hospitalisés.

En tout, 13 nouveaux cas de Coronavirus Covid-19 ont été confirmés ce week-end en Nouvelle-Aquitaine. Cinq en Charente-Maritime donc mais aussi cinq dans le Lot-et-Garonne, un dans la Vienne, un en Corrèze et un en Gironde. Des cas identifiés grâce au suivi médical assuré par l'Agence Régionale de Santé auprès des proches de cas déjà connus.

Cela porte à 29 le nombre de cas confirmés dans la région. ""On observe une forte augmentation du nombre cas confirmés ces dernières 24h."" affirme l'ARS.","Coronavirus : 55 nouveaux cas en Nouvelle-Aquitaine, contre 40 lundi 9 mars","L'Agence Régionale de Santé annonce, dans son point journalier ce mardi 10 mars 2020, 15 nouvelles contaminations au coronavirus en Nouvelle-Aquitaine.",Coronavirus : 13 nouveaux cas confirmés en Charente-Maritime,Un couple en lien avec un cas recensé en Occitanie et trois personnes en contact avec autre patient infecté déjà connu précise l'Agence Régionale de Santé.,2,2.0,4,13,0,"['Agence Régionale de Santé', 'ARS']",[],57.11,46.33,29.69,41.36,12.920000000000002,99.95,29.279999999999994,394.6,261.6
3456,Règlement sur les chiens dangereux : « On est prêt à l’appliquer » - SPA Mauricie,Don de nourriture pour animaux de compagnie par la SPA Mauricie,"SPA : nouvelles règles pour les chiens, ce qui change pour les propriétaires

08 h 24 SPA : nouvelles règles pour les chiens, ce qui change pour les propriétaires Durée : 9:15

Dans la région, les patrouilleurs de la Société protectrice des animaux (SPA) de la Mauricie seront responsables de faire appliquer le nouveau Règlement d'application de la Loi sur l'encadrement des chiens qui entre en vigueur mardi.

Le directeur général de la SPA Mauricie, Marco Champagne, explique que neuf personnes sont déjà assermentées par les différentes cours municipales des MRC qui nous entourent

Les patrouilleurs peuvent émettre des constats d’infraction. On a également un pouvoir de saisie qui a été ajouté et qui va faciliter le travail dans le cas où un récalcitrant ne voudrait pas faire l'examen du médecin vétérinaire au niveau comportemental , a-t-il expliqué en entrevue à l’émission Facteur matinal.

Désormais, les chiens de 20 kg et plus devront porter un licou ou un harnais en tout temps. De plus, le port d'une laisse d'une longueur maximale de 1,85 mètre sera aussi obligatoire, sauf dans les parcs à chiens, à la chasse, dans un cours de dressage ou une compétition canine.

Marco Champagne ajoute que les patrouilleurs auront aussi le rôle de sensibiliser la population aux nouvelles règles.","La Société protectrice des animaux (SPA) de la Mauricie souhaite donner un coup de main aux propriétaires d'animaux en ces temps de pandémie.

Certains d’entre eux vivent des difficultés financières. C’est pourquoi l’organisme fait don d’une tonne de nourriture pour animaux à Moisson Mauricie-Centre-du-Québec.

Ainsi, la SPA estime pouvoir aider environ 250 familles de la région.

Nous ce qu’on souhaite, c’est que les gens conservent leurs animaux de compagnie même dans les situations précaires, parce que l’animal est déjà dans une bonne famille. Souvent, quand l’animal arrive à la SPA Mauricie, il vit un stress avec nous, il se retrouve quelques jours, quelques semaines avec nous, et on le replace dans une nouvelle famille. Mais ce qu’on souhaite pour le moment, c’est que les gens conservent leurs animaux de compagnie à la maison , explique le directeur général, Marco Champagne.

Cette quantité de nourriture a été amassée grâce aux dons de la communauté. Elle sera distribuée équitablement entre les familles qui en feront la demande.","SPA : nouvelles règles pour les chiens, ce qui change pour les propriétaires","Dans la région, les patrouilleurs de la SPA seront responsables de faire appliquer le nouveau Règlement d'application de la loi sur l'encadrement des chiens.",Moisson Mauricie-Centre-du-Québec : une tonne de nourriture pour animaux pour aider les propriétaires d'animaux,La SPA de la Mauricie souhaite donner un coup de main aux propriétaires d'animaux en ces temps de pandémie. Certains d'entre eux vivent des difficultés financières.,3,3.0,8,1,0,"['Marco', 'Société protectrice des animaux', 'Champagne', 'SPA Mauricie', 'SPA']",[],46.37,29.74,30.35,70.47,15.3,99.86,32.79,295.6,347.5
3457,Le PJD au cœur d’un scandale d’espionnage ?,Maroc : des présidents de communes poursuivis par la justice,"Des activistes du Parti de la Justice et du développement (PJD) auraient installé des caméras cachées de surveillance dans 40 annexes administratives relevant du ministère de l’Intérieur. Une opération d’espionnage mise à nu.

Il a été découvert des caméras cachées, installées par des activistes du PJD, dans 40 annexes relevant du ministère de l’Intérieur, rapporte Assabah. La même source indique que ces caméras servent à espionner les caïds, pachas et autres autorités locales et ne sont nullement contrôlées par les services du ministère de l’Intérieur.

Selon certaines indiscrétions, le conseil de la ville de Marrakech avait lancé un avis d’appel d’offres pour l’acquisition et l’installation des caméras. Or, il est de notoriété publique, affirme la même source, que ce conseil est sous l’influence du PJD. En clair, ces caméras ont été posées dans le dessein d’espionner des cadres ou autorités appartenant à d’autres formations politiques.","Le ministère de l’Intérieur a enclenché des poursuites judiciaires contre une trentaine de présidents de communes, auxquels s’ajoutent 15 vice-présidents et 34 conseillers communaux, pour avoir dilapidé les deniers publics et falsifié des documents administratifs.

Un document officiel envoyé par le ministère de l’Intérieur aux membres de la Commission de l’intérieur, des collectivités territoriales, de l’habitat et de la politique de la ville au sein de la Chambre des Représentants indique que 26 jugements ont été prononcés à l’encontre des présidents des communes et leurs substituts, rapporte Assabah. Ils ont été sanctionnés pour mauvaise gestion des budgets et des affaires financières, fait savoir la même source. Au regard de la loi, ces élus risquent gros notamment la révocation, la perte du statut d’éligibilité et d’électeur.

Ainsi, les gouverneurs ou leurs intérimaires ont saisi les tribunaux administratifs pour demander la révocation des membres concernés des conseils des communes et aussi des présidents et de leurs vice-présidents, conformément aux dispositions des articles 64 et 70 de la loi organique relative aux communes et l’article 71 de la loi organique relative aux préfectures et provinces.

En conséquence, 84 membres des conseils communaux ont été révoqués après que leurs dossiers ont été déférés devant le tribunal administratif. 27 présidents ont été également révoqués conformément à l’article 70. Un seul président a été révoqué conformément à l’article 71 de la loi organique relative aux préfectures et provinces.",Marrakech : des caméras cachées installées par des activistes du PJD,Des activistes du Parti de la Justice et du développement auraient installé des caméras cachées de surveillance dans 40 annexes administratives.,Algérie : des présidents de communes révoqués pour dilapidé les deniers publics,Le ministère de l'intérieur a enclenché des poursuites judiciaires contre une trentaine de présidents de communes pour avoir dilapidé les deniers publics et falsifié des documents administratifs.,4,4.0,1,6,0,['ministère de l’Intérieur'],[],24.48,10.02,37.33,31.17,11.420000000000002,99.71,27.88000000000001,9.1,184.6
3458,Val-d’Oise. Photo à Pontoise : Petit-Martroy confiné,Val-d’Oise. Photo : intermittents en colère à Pontoise,"La place du Petit-Martroy en mode confiné.

Quel plaisir de voir la chaussée de la place du Petit-Martroy de Pontoise, dans le Val-d’Oise, vierge de tout véhicule.

Lire aussi : Val-d’Oise. Photo : Pontoise à l’arrêt

Les voitures des habitants confinés mises à part, le centre-ville de la sous-préfecture du Val-d’Oise semble même déserté. Le photographe Doudou RH a immortalisé ce moment rare et le propose en guise de cliché de la semaine.

Bien vu Doudou.

Pour admirer les dernières œuvres de Doudou Rh, rendez-vous sur sa page Facebook : Cuistographe DoudouRh. Pour le contacter par mail : haroun15@gmail.com","Cette semaine, le photographe Doudou RH propose un cliché pris lors d’une manifestation d’intermittents du spectacle, qui s’est déroulée samedi 6 juin 2020, sur le marché du centre-ville de Pontoise (Val-d’Oise).

Respectueux des mesures sanitaires, sachant qu’ils étaient moins d’une dizaine (trois en l’occurrence), les manifestants souhaitaient alerter le grand public quant à leur situation, à l’issue du confinement.

Lire aussi : Portrait. Doudou Rh, son objectif compense ses yeux

Pour eux, « les promesses du gouvernement et la réouverture des théâtres ne vont pas aider la plupart des intermittents du spectacle ».

Il s’agissait, par ailleurs, d’un mouvement national repris localement pas les syndicats du spectacle. Notre cuistographe y était.

Bien vu Doudou.

Pour admirer les dernières œuvres de Doudou Rh, rendez-vous sur sa page Facebook : Cuistographe DoudouRh. Pour le contacter par mail : haroun15@gmail.com

Lire aussi : Val-d’Oise. Photo : Doudou RH aux confins du confinement à Pontoise",Val-d'Oise : la place du Petit-Martroy en mode confiné,"Le photographe Doudou RH a immortalisé la place du Petit-Martroy de Pontoise, dans le Val-d'Oise, en guise de cliché de la semaine.",Val-d'Oise : le photographe Doudou RH prend un cliché lors d'une manifestation d'intermittents du spectacle,"Cette semaine, le photographe Doudou RH propose un cliché pris lors d'une manifestation d'intermittents du spectacle, sur le marché du centre-ville de Pontoise (Val-d'Oise).",3,3.0,0,12,0,[],[],40.79,23.95,75.51,15.399999999999995,9.08,99.9,28.92,178.2,311.8
3459,Coronavirus: premier mort en Espagne (officiel),Coronavirus: l'Espagne dépasse la barre des 10.000 morts (autorités),"L'Espagne a annoncé mardi un premier mort dû à l'épidémie provoquée par le nouveau coronavirus, un homme décédé en février dont l'autopsie a révélé qu'il était porteur du virus, ont annoncé les autorités de la région de Valence (est).

""C'est un patient décédé le 13 février dernier"" dans un hôpital de Valence et dont les analyses post-mortem se sont révélées ""positives"", a expliqué à la presse la responsable régionale de la Santé Ana Barceló Chico.","L'Espagne a franchi jeudi la barre des 10.000 morts dus à la pandémie de coronavirus après avoir enregistré 950 décès en 24 heures, un nouveau record dans le pays, ont annoncé les autorités.

Au total, 10.003 personnes sont mortes du Covid-19 en Espagne, deuxième pays le plus endeuillé par la maladie dans le monde. Le nombre de cas confirmés a dépassé pour sa part la barre des 110.000 mais la progression du nombre de nouveaux cas continue de ralentir.",Espagne : premier mort dû au coronavirus,"L'Espagne a annoncé un premier mort dû à l'épidémie provoquée par le nouveau coronavirus, un homme décédé en février dont l'autopsie a révélé qu'il était porteur du virus.",Coronavirus : l'Espagne franchit la barre des 10.000 morts,L'Espagne a franchi jeudi la barre des 10.000 morts dus à la pandémie de coronavirus après avoir enregistré 950 décès en 24 heures.,2,2.0,0,5,0,[],[],70.39,69.11,55.3,22.5,11.06,98.15,27.31,165.9,343.3
3461,Lancement d'une campagne contre le moustique tigre,"Cet été, participez à la chasse au moustique tigre !","Le moustique tigre, originaire des forêts tropicales d'Asie du Sud-Est, est installé en France depuis 2004, apporté par les activités humaines, notamment le commerce international de pneus. Il transmet des maladies comme la dengue et le Zika.

De petite taille, noir et blanc, le moustique tigre est présent dans une soixantaine de départements français et transmet des maladies comme la dengue et le Zika. Ce samedi, l'Anses démarre une campagne contre cet insecte invasif.



Originaire des forêts tropicales d'Asie du Sud-Est, le moustique tigre est installé en France depuis 2004, apporté par les activités humaines, notamment le commerce international de pneus.



Il peut transmettre à l'homme des maladies comme la dengue, le chikungunya et Zika. L'Agence nationale de sécurité sanitaire alimentation, environnement, travail (Anses) lance donc une campagne pour l'identifier et signaler sa présence sur le site signalement-moustique.anses.fr.

""Pour éviter les erreurs, le site guide les internautes à l'aide de photos ainsi que trois questions: le moustique identifié est-il de petite taille ? Est-il noir et blanc ? Dispose-t-il d'un appareil piqueur ?"", explique l'Anses. Autre caractéristique, il pique plutôt le jour.

Prolifération dans les zones urbaines

Il se développe particulièrement dans les zones urbaines et péri-urbaines et prolifère dans des réservoirs d'eau ou des récipients: vases, pots, gouttières...

Pour lutter contre sa prolifération, il faut vider régulièrement les coupelles sous les pots de fleurs, mettre les récipients à l'abri de la pluie, recouvrir les bidons de récupération d'eau de pluie avec des moustiquaires et introduire des poissons dans les bassins d'agrément qui mangeront les larves.

Il est aussi conseillé d'entretenir son jardin et de se protéger avec des vêtements longs, amples et clairs, des moustiquaires et des produits répulsifs.","Pour contrôler la propagation du moustique tigre, présent dans 60 départements de France cette année, l'Anses lance une plateforme visant à signaler la présence de cet insecte. L'agence sanitaire délivre également des conseils pour se protéger des piqûres et pour identifier le moustique tigre.

Comme chaque été, le moustique tigre fait son retour en France. Présent dans une soixantaine de départements de l'Hexagone cette année, cet insecte suscite l'inquiétude car il est porteur de plusieurs virus dangereux pour l'humain, comme le Chikungunya, le Zika et la dengue.

Pour mieux contrôler la propagation de ce moustique, l'Agence nationale de sécurité sanitaire alimentation, environnement, travail (Anses) invite chaque Française et Français à signaler la présence du moustique tigre dans leur région.

Mais attention, le moustique tigre n'est pas similaire à ses congénères. De petite taille, noir et blanc, cette espèce de moustique présente des caractéristiques physiques précises, que l'Anses détaille sur sa plateforme signalement-moustique.

Un signalement photo

""Le moustique tigre est silencieux et diurne, c'est-à-dire qu'il pique plutôt le jour [principalement le matin et le soir], alors que le moustique commun a plutôt tendance à piquer la nuit"", précise par exemple l'Anses.

Le signalement du moustique tigre se fait en postant une photographie de bonne qualité sur le site de l'Anses. Une fois cette condition remplie, afin de certifier qu'il s'agit bien d'un moustique tigre, l'utilisateur de la plateforme devra répondre à trois questions relatives à l'apparence de l'insecte traqué. Si les caractéristiques décrites correspondent au moustique tigre, le signalement peut être envoyé.

Pour se protéger des piqûres des moustiques tigre, il est recommandé de porter des vêtements longs, amples clairs, de poser des moustiquaires dans son habitation et d'utiliser des produits répulsifs cutanés.",Le moustique tigre est-il de petite taille ?,"Le moustique tigre, originaire des forêts tropicales d'Asie du Sud-Est, transmet des maladies comme la dengue et le Zika.",L'Anses lance une plateforme pour signaler la présence d'un moustique tigre,"Pour contrôler la propagation du moustique tigre, l'Anses lance une plateforme visant à signaler la présence de cet insecte.",1,1.0,5,4,0,"['Agence nationale de sécurité sanitaire alimentation, environnement, travail', 'Anses']",[],77.57,45.86,63.84,94.68,9.18,99.62,26.07,24.4,192.7
