ligne,title_1,title_2,text_1,text_2,summary1_text1,summary2_text1,summary1_text2,summary2_text2,Overall,Overall2,nb_entites_idem,nb_lieux_idem,nb_dates_idem,entites_idem,dates_idem,score_similarite_titres,score_similarite_resume1,score_similarite_resume2,score_classif1,score_classif2,score_sentiment1,score_sentiment2,meth1_similarites,meth2_similarites
1937,Voir le calendrier des échéances de l'impôt provincial sur les automobiles (IPA) et de l'impôt général sur les biens immobiliers à Posadas.,Il a été arrêté pour avoir écrasé et tué son ex-belle-fille.,"La municipalité de Posadas a publié le calendrier des échéances de la taxe provinciale sur les véhicules à moteur (IPA) pour tous les types de véhicules de 2019 et des modèles antérieurs.

La première tranche de cet impôt est due le 27 janvier, la deuxième le 16 mars, la troisième le 15 avril, la quatrième le 15 mai, la cinquième le 16 juin et la sixième le 15 juillet.

Les résidents peuvent demander leurs reçus au Centro de Atención Tributaria - situé sur l'avenue Trincheras de San José au 2.385 près de l'Uruguay - ou aux Centres d'intégration territoriale, qui sont autorisés à délivrer des reçus pour tous les impôts.

D'autre part, le Centro de Atención al Ciudadano a expliqué que les bons de paiement de l'IPA peuvent être demandés gratuitement en appelant le 0800-888-2483, de 7 à 12 heures, pour éviter de se rendre à la municipalité ou aux bureaux municipaux.

Ils peuvent être payés au rez-de-chaussée du bâtiment municipal, dans les agences Rapipago, Pago Fácil, Cobro Express, Banco Macro, les agences de paris officielles, le Centro de Atención Tributaria ou par le biais du système Pago Mis Cuentas.

Dates d'échéance de la taxe générale sur les biens immobiliers

La municipalité de cette ville informe les voisins des dates d'échéance de la taxe foncière générale pour la période fiscale 2020. L'horaire sera le suivant :

Versement 1 : 10","Mercredi, 01 Janvier 2020 17:29

La police a réussi à trouver et à arrêter l'homme qui a intentionnellement écrasé et tué son ancienne belle-fille lors d'un incident survenu dans la ville de Lavalle, à Mendoza.

Selon les médias nationaux, le détenu a été identifié comme étant Juan Alberto Torres García, qui a été accusé d'un prétendu ""féminicide"".

L'incident a eu lieu lundi à 22h30 sur la route provinciale 34 et la victime était Damaris Lucero. Torres García, qui conduisait une Volkswagen Polo, a traversé la voie et a écrasé la jeune femme, qui est morte sur le coup, devant son jeune fils et son compagnon actuel.

Après l'incident, le conducteur a abandonné le véhicule en marche à une centaine de mètres de l'endroit où il avait écrasé la victime et s'est enfui à pied, tandis que quelques heures plus tard, il était arrêté par la police.

D'autre part, on a appris que la principale hypothèse pour expliquer le meurtre était des différends de longue date entre l'homme arrêté, père d'un ancien partenaire de la jeune femme décédée, et son ancienne belle-fille sur des questions familiales.",Taxe sur les véhicules à moteur : la municipalité de Posadas publie le calendrier des échéances,La municipalité de Posadas a publié le calendrier des échéances de la taxe provinciale sur les véhicules à moteur (IPA) pour tous les types de véhicules de 2019 et des modèles antérieurs.,Argentine : un homme arrêté pour le meurtre d'une ancienne belle-fille,"La police a réussi à arrêter l'homme qui a intentionnellement écrasé et tué son ancienne belle-fille lors d'un incident survenu dans la ville de Lavalle, à Mendoza.",4,4.0,0,0,0,[],[],10.44,2.48,19.08,3.03,8.97,85.31,42.26,33.4,33.5
1942,Arrêté pour avoir échangé les conducteurs d'une voiture après un accident avec délit de fuite à Murcie,Les pompiers sauvent un chien paniqué par le bruit des pétards,"Arrêté pour avoir échangé les conducteurs après un accident avec délit de fuite à Murcia, Espagne.

Arrêté pour avoir échangé le siège conducteur d'une voiture après un accident et pris la fuite à Murcie

La police locale de Murcie a arrêté ce mercredi deux individus qui avaient échangé le siège du conducteur d'une voiture après un accident et pris la fuite.

L'incident s'est produit mercredi après-midi, lorsque des agents du groupe motorisé ont procédé à l'arrestation des deux individus dans le quartier Infante D. Juan Manuel.

Selon la police locale sur son compte Twitter, les deux individus ont été arrêtés après avoir conduit le même véhicule après avoir eu un accident.

""Ils ont changé de conducteur et ont tenté de fuir, mais n'ont pas atteint leur objectif"", a déclaré la police locale.","Les pompiers de Palma ont sauvé un chien coincé entre une colonne et un mur vers 6h30 ce mercredi matin, dans un état de panique dû au bruit des pétards utilisés pour célébrer le Nouvel An.

Selon l'Agrupación Cultural de los Bomberos de Palma sur son compte Twitter, il a fallu enduire l'animal d'huile pour le faire sortir, en le faisant soigneusement glisser vers l'arrière. Ce processus a nécessité environ 30 minutes de travail et, selon les pompiers, le chien a ""coopéré à tout moment"".

Les pompiers ont rappelé, par le biais de leur compte sur ce réseau social, que les tirs inconsidérés de feux d'artifice, si fréquents pendant les fêtes de fin d'année, peuvent être très dangereux pour les animaux tels que les chiens, qui sont très sensibles au son émis par les pétards.",Espagne : arrêté pour avoir échangé le siège conducteur d'une voiture après un accident,La police locale de Murcie a arrêté ce mercredi deux individus qui avaient échangé le siège du conducteur d'une voiture après un accident et pris la fuite.,Espagne : un chien coincé entre une colonne et un mur pendant les feux d'artifice,"Les pompiers de Palma ont sauvé un chien coincé entre une colonne et un mur vers 6h30 ce mercredi matin, dans un état de panique.",4,4.0,0,0,0,[],[],4.16,22.42,22.41,45.24999999999999,9.22,13.23,27.16,0.0,3.8
1947,"Une année 2019 qui laisse le Port stagnant, sans croissance et avec de nombreux conflits sociaux.",Lora del Río fait ses adieux au mineur tué par un train et décrète trois jours de deuil,"Guaymas, Sonora - Au cours de l'année 2019 avec Sara Valle Dessens à la tête du gouvernement municipal et malgré une série de tentatives pour redresser la barre, pratiquement jusqu'aux derniers mois de l'année, une petite amélioration a été constatée, selon la perception des citoyens.

En ce qui concerne la fourniture de services de base à la communauté, la collecte des ordures a été une fois de plus la question à suivre, après la déficience montrée principalement pendant la saison d'été, quand en raison des excuses des températures élevées, les travailleurs ont renoncé à sortir dans les rues.

En termes de travaux publics, à l'exception du pavage de trois blocs de l'Avenida 6, de la Calle 10 à la Calle 13, il n'y a rien eu de notable, mais des allées en béton ont été livrées à certains quartiers marginalisés.

Les finances municipales, a été une question où au cours de 2019, il a été mis l'accent sur l'assainissement, qui, même s'il est vrai que plusieurs engagements de dettes qui ont traîné pendant un certain temps ont été supprimés, les questions liées à la collecte et l'échange de paiements de prédiales ont été laissés dans ""l'air"".

Du côté du commerce, les chambres et associations d'entreprises s'accordent à dire que l'économie a stagné, en allusion à la première année du gouvernement fédéral et aux coupes budgétaires qui ont touché tous les secteurs du pays, et le port n'a pas fait exception.","Mardi, aux abords de la mairie de Lora del Río (Séville), une minute de silence a été observée en hommage à Raúl, le jeune garçon de 15 ans qui est mort écrasé par un train régional lundi dernier dans le hameau d'El Priorato, un acte auquel a assisté l'ensemble de la corporation locale, qui a convenu au sein du conseil des porte-parole de décréter trois jours de deuil, de mardi à jeudi.

C'est ce qu'a annoncé le maire, Antonio Miguel Enamorado, dans des déclarations aux journalistes. Il a précisé que les funérailles de l'enfant n'ont pas encore été programmées, car l'autopsie n'a pas encore été réalisée, et que, suite à ce tragique événement, il demande à l'Adif d'améliorer les mesures de sécurité pour empêcher l'accès aux voies ferrées et de placer des clôtures autour du hameau d'El Priorato, où l'enfant a été écrasé alors qu'il jouait avec quatre autres enfants.

""Les mesures ont déjà été améliorées dans le centre principal, mais nous voulons qu'elles le soient aussi pour El Priorato"" car il ne peut y avoir ""des quartiers qui sont souvent oubliés précisément parce que ce sont de petits quartiers"", a argumenté le maire, qui a exprimé son affection pour la famille de l'enfant et a souhaité que ceux qui ont été témoins de ce tragique accident puissent ""se remettre de ce coup tragique qui, de plus, est intensifié par la période de l'année"".

Selon le maire, l'unité de police judiciaire (UOPJ) de la Guardia Civil de Lora del Río enquête sur l'incident et a déjà appelé à témoigner les quatre mineurs qui se trouvaient avec le défunt au moment de l'accident.

Il a également informé que la mairie a mis à la disposition des personnes touchées un service de traitement psychologique et qu'à l'occasion des trois jours de deuil, tous les événements susceptibles d'avoir lieu dans la ville ont été suspendus, citant à titre d'exemple qu'à Lora, il n'est pas traditionnel de célébrer le début de la nouvelle année sur la place principale, mais que si c'était le cas, cela ne se serait pas fait.

En 2002, une personne a également été écrasée par un train à Lora del Río, comme le rappelle le maire. Après cet événement, l'Adif a placé un viaduc dans la zone où il s'est produit pour éviter que les agriculteurs passant d'un côté à l'autre de la voie ferrée n'aient à la traverser.

L'incident de ce lundi s'est produit vers 19h30, lorsque l'Adif a alerté le service d'urgence 112 qu'un train avait écrasé un mineur à la sortie de la gare d'El Priorato, en direction de Séville. L'Empresa Pública de Emergencias Sanitarias (EPES 061), qui n'a pu que constater le décès de la victime, ainsi que des membres de la Guardia Civil, des pompiers de la Diputación de Séville, de la police locale et de l'unité de police nationale rattachée à la Communauté autonome, dite police autonome, se sont rendus au poste.

La Guardia Civil a activé le protocole judiciaire pour déterminer si l'événement est survenu accidentellement.","Guaymas, Sonora : malgré une série de tentatives pour redresser la barre, les habitants continuent de sourire","La collecte des ordures a été une fois de plus la question à suivre, après la déficience montrée principalement pendant la saison d'été.",Séville : trois jours de deuil après la mort d'un enfant de 15 ans,"Une minute de silence a été observée en hommage à Raúl, le jeune garçon de 15 ans qui est mort écrasé par un train régional lundi dernier dans le hameau d'El Priorato, un acte auquel a assisté l'ensemble de la corporation locale.",4,4.0,0,0,0,[],[],16.74,13.95,13.6,12.6,9.1,0.38,24.8,51.7,47.3
1949,"À partir d'aujourd'hui, le coût des passeports pour les Mexicains à l'étranger augmente",Faibles ventes signalées par les vendeurs du marché de rue Abraham González - Impacto,"À partir d'aujourd'hui, 1er janvier 2020, tous les Mexicains vivant à l'étranger devront payer davantage pour la délivrance de passeports, d'enregistrements consulaires et de déclarations de nationalité.

La Direction générale des services consulaires a informé qu'à partir de cette date, tous les services offerts par les consulats mexicains à l'étranger auront des coûts plus élevés.

Les nouveaux frais fixent à 30 dollars le coût de l'inscription consulaire. Jusqu'à la veille, il coûtait 27 dollars ; les passeports pour un an et les cas de protection consulaire, 34 dollars ; les passeports pour trois ans, 78 dollars et pour six ans, 107 dollars. La déclaration de nationalité coûtera 17 dollars, soit deux dollars de plus qu'en 2019.

Et les ressortissants qui font un testament public dans un bureau consulaire à l'étranger paieront 50 % du montant.

Ces documents sont facturés en dollars américains depuis 2004 et ont été modifiés en 2007. Depuis cette date, il n'y a pas eu de changement malgré l'augmentation des coûts d'entretien du réseau consulaire.

Conformément aux dispositions de la loi fédérale sur les redevances pour l'exercice 2020, qui a été publiée au Journal officiel de la Fédération le 9 décembre 2019, les redevances en dollars américains pour la fourniture de services couverts par la loi fédérale sur les redevances seront modifiées en 2020.","CAMARGO - Au petit marché du quartier Abraham González, les vendeurs ambulants ont signalé une baisse considérable des ventes, selon le responsable de l'espace extérieur, Manuel Ramos.

Il a déclaré qu'il y avait sans aucun doute de nombreuses améliorations en 2019 par le maire Arturo Zubia Fernández, cependant, les gens ne viennent pas faire leurs courses comme par le passé.

Il a indiqué qu'avant Noël, on s'attendait à une reprise, mais que la fréquentation a diminué de 40%.

""Il y a peut-être plusieurs facteurs, dont le froid. Les gens ne font plus autant d'achats qu'avant. Cependant, nous nous améliorons grâce au maire"", a-t-il déclaré.","Les passeports, les passeports et les déclarations de nationalité seront plus chers à partir du 1er janvier 2020","A partir d'aujourd'hui, tous les Mexicains vivant à l'étranger devront payer davantage pour la délivrance de passeports, d'enregistrements consulaires et de déclarations de nationalité.",Coronavirus : les ventes au marché de Camargo ont chuté de 40% en 2019,"Les vendeurs ambulants ont signalé une baisse considérable des ventes, selon le responsable de l'espace extérieur, Manuel Ramos.",4,4.0,0,0,0,[],[],13.13,7.16,11.79,31.19,9.59,88.44999999999996,34.68,14.6,25.7
1951,Robertico accueille 2020 avec la tradition cubaine de partir avec des valises pour voyager.,"""Les professeurs anarchistes encourageaient les valeurs et l'inclination personnelle de chaque élève ""##Enric Llopis","Publié le mercredi 1 janvier 2020 - 06:40 (GMT-4)

L'humoriste cubain Robertico a partagé une vidéo drôle sur ses réseaux sociaux avec laquelle, une fois de plus, il a fait sourire plus d'un adepte.

L'humoriste a célébré l'arrivée de la nouvelle année dans sa résidence de La Havane, entouré de ses amis et de sa famille. En tant que bon créateur d'histoires et de blagues, mais aussi de musique, de nourriture et de danse, l'humour n'était pas absent de l'événement.

Robertico et plusieurs de ses invités ont voulu accueillir 2020 avec la tradition cubaine qui consiste à se promener avec des valises vides afin d'attirer les voyages à l'étranger. Ils n'ont donc pas hésité à prendre un bagage à la main et à se joindre à la croyance.

Pas de publicité pour vous

""Pour l'année prochaine, faire le voyage, pour ceux qui n'ont pas voyagé, pour ceux qui n'ont pas 'fasteado'"", a plaisanté Robertico.

Plusieurs des fêtards se promènent avec une valise dans la cour de la maison en faisant le tour d'une piscine, chacun disant les destinations vers lesquelles il aimerait voyager. ""Le Canada, l'Espagne, Singapour, l'Égypte"" sont quelques-uns des pays mentionnés par les Cubains.

Ce moment drôle a été partagé par Robertico lui-même sur ses réseaux sociaux et beaucoup de ses fans ont commenté avec des émoticônes de rire et ont laissé des messages pleins d'affection tels que ""Tu es le meilleur"", ""Quel comique"", ""Nous, les Cubains, avons vraiment de l'esprit"" ou ""Bonne année à nous tous Rober"".","Rébellion

Entretien avec le professeur d'histoire Emili Cortavitarte, auteur de Movimiento libertario y educación en España (1901-1939)

Qu'est-ce qui différencie la pédagogie libertaire, promue par les écoles rationalistes dans le premier tiers du XXe siècle, de l'enseignement conventionnel d'aujourd'hui ? Pas tant les connaissances que les valeurs transmises et l'importance des relations personnelles dans l'apprentissage"", résume Emili Cortavitarte, professeur d'histoire à la retraite et militante CGT. Aujourd'hui, les enseignants sont ""très professionnels"", les processus d'apprentissage sont ""très techniques"" et les matières sont enseignées de manière partielle et spécialisée. ""La langue ou les mathématiques sont expliquées à des élèves avec lesquels il n'y a pas d'intérêt particulier à maintenir une relation de personne à personne"", ajoute l'auteur du livre Movimiento Libertario y educación en España (1901-1939), publié en 2019 par Calumnia. --- Voir les nouvelles ---",Cuba : un célèbre humoriste fait rire plus d'un adepte,"L'humoriste cubain a partagé une vidéo drôle sur ses réseaux sociaux avec laquelle, une fois de plus, il a fait sourire plus d'un adepte.",Pédagogie libertaire : ce que l'on sait de l'enseignement d'aujourd'hui,"Entretien avec le professeur d'histoire Emili Cortavitarte, auteur de ""Movimiento libertario y educación en España"" (1901-1939).",4,4.0,0,0,0,[],[],17.03,13.67,14.1,10.490000000000002,9.710000000000004,0.11,29.440000000000005,88.7,6.0
1965,Les chercheurs de La Mayora testent la première culture de cacao en Europe,Crise climatique : les chiffres qui démontent les affirmations d'Ayuso : la pollution a fait 34 300 morts en Espagne en 2016.,Les chercheurs de La Mayora testent la première culture de cacao en Europe Les scientifiques de la station du CSIC à Algarrobo sèment 80 plantes dans des serres et attendent les premiers fruits l'année prochaine Image de plusieurs des plantes semées par les scientifiques de La Mayora à la station expérimentale. ,"La présidente de la Communauté de Madrid, Isabel Díaz Ayuso, a affirmé mercredi que ""personne n'est mort"" à cause de la pollution à Madrid, ajoutant qu'elle ne veut pas que ""l'on crée une alarme de santé publique car il n'y en a pas"". Cependant, les dernières données de l'Agence européenne pour l'environnement (AEE) -correspondant à 2016- établissent que la pollution a fait 34 300 morts dans le pays au cours de cette année.

Le rapport européen sur la qualité de l'air, publié en juin dernier, montre une légère baisse par rapport aux chiffres de 2015, puisque 38 600 décès prématurés dus à la pollution ont été enregistrés. En 2014, l'EEE a enregistré 31 520 décès.

Les déclarations d'Ayuso ont suscité des réactions immédiates de la part des scientifiques et des experts. Le Conseil national de la recherche espagnol (CSIC) a prévenu sur Twitter qu'il existe plusieurs rapports qui ""confirment la relation entre la pollution et le risque de mortalité"".

D'autres études, comme celle de la Société espagnole de pneumologie et de chirurgie thoracique (SEPAR), établissent que ""la pollution atmosphérique provoque 10 000 décès par an en Espagne"". Un chiffre ""bien supérieur"" au nombre de victimes d'accidents de la circulation, qui s'est établi à 1 806 décès en 2018, selon la Direction générale de la circulation.",La Mayora testent la première culture de cacao en Europe,Les scientifiques de la station du CSIC à Algarrobo testent la première culture de cacao en Europe.,"Pollution : ""personne n'est mort"" à Madrid, assure la présidente de la Communauté de Madrid","La présidente de la Communauté de Madrid, Isabel Díaz Ayuso, a affirmé mercredi que ""personne n'est mort"" à cause de la pollution à Madrid.",4,4.0,0,2,0,[],[],18.8,-10.4,-4.52,91.72,8.14,80.76,18.7,57.0,89.7
1970,"La grenouille arlequin, une espèce en voie d'extinction",Une fillette de 6 ans meurt à cause de l'automédication de ses parents,"Grenouille arlequin, l'espèce qui sort de l'extinction PHOTO COURTOISIE globalwildlife

Pendant près de 30 ans, l'espèce de grenouille arlequin a été cachée à la science. Aujourd'hui, elle a refait surface et après une longue enquête menée par un groupe de biologistes dans la Sierra Nevada de Santa Marta, dans le nord de la Colombie, ils ont réussi à la documenter.

Grenouille arlequin PHOTO COURTOISIE DU NATIONAL GEOGRAPHIC

Selon la liste rouge des espèces menacées de l'UICN, 80 des 96 espèces connues de grenouilles arlequins sont en danger, en danger critique d'extinction ou même éteintes à l'état sauvage, en raison des maladies infectieuses, de la destruction et de la dégradation de l'habitat, des espèces envahissantes et du changement climatique.

Cette espèce que l'on croyait éteinte a été photographiée pour la dernière fois en 1991.

""Nous étions pleins de joie et d'espoir d'avoir la possibilité d'observer cette espèce d'un genre dont il ne reste que très peu d'exemplaires"", a déclaré José Luis Pérez, biologiste à la Fondation Atelopus.

Il convient de mentionner qu'ils ont l'intention de mettre en place un programme de surveillance de la grenouille arlequin de nuit étoilée, et de réunir les perspectives scientifiques et spirituelles pour continuer à mieux protéger les amphibiens.

Grenouille arlequin PHOTO COURTESY VERY INTERESTING MAGAZINE

FAITS IMPORTANTS SUR LA GRENOUILLE ARLEQUIN

37 espèces de grenouilles arlequins ont disparu de leurs habitats connus et n'ont pas été vues depuis le début des années 2000.

Estimés être nés des poissons il y a environ 360 millions d'années, les amphibiens se distinguent en subissant une transformation complète au cours de leur développement.

Cet amphibien coloré est généralement jaune, vert vif, orange ou rouge, avec un motif de taches ou de rayures noires.

Cela pourrait vous intéresser : Les ouaouarons, l'envahisseur le plus agressif.

Les mâles ne mesurent pas plus de 3,5 cm de long et les femelles entre 3,3 cm et 54,5 cm environ.

Cette espèce était distribuée dans les zones de moyenne altitude le long des chaînes de montagnes, y compris la Fila Costeña au sud du versant Pacifique, entre 800 et 1500m.

Ce sont des animaux diurnes.

Ils forment des agrégations le long des rivières pendant la saison sèche, mais sont répartis plus uniformément pendant la saison des pluies.

Suivez-nous sur instagram et recevez les dernières nouvelles et tendances de la semaine.","Une fillette de 6 ans meurt à cause de ses parents, qui l'ont auto-médicamentée

Une fillette de six ans a perdu la vie après que ses parents, par manque de ressources, ne se sont pas rendus chez le médecin et ont pratiqué l'automédication de la fillette après qu'elle ait eu la diarrhée.

Les événements se sont produits à Saltillo et tout a commencé par une diarrhée. Ses parents lui ont donné une pilule pour essayer de l'arrêter. Lorsqu'ils ont vu que l'enfant continuait à avoir les mêmes problèmes, les parents ont décidé de lui donner un deuxième médicament dans l'espoir qu'elle se rétablisse.

L'état de la fillette de six ans s'est aggravé jusqu'à ce qu'elle gît inconsciente sur le sol, la bouche meurtrie.

Les parents se sont immédiatement rendus avec l'enfant dans les locaux de la Croix-Rouge, où elle a malheureusement perdu la vie en raison des effets secondaires de l'automédication. Les médias ont révélé que les parents ont donné à l'enfant du ""Treda"" et que, ne voyant aucun souvenir, ils ont décidé de lui donner un autre médicament dont la marque n'est pas connue pour le moment.

L'ENFANT DEVIENT VIRAL

Lorsque la situation a été connue, les réseaux sociaux se sont retournés contre les parents, affirmant que c'était une erreur de ne pas s'être rendu chez le médecin lorsque cela était nécessaire pour une évaluation rapide de la fillette de six ans.

PEUT ÊTRE INTÉRESSÉ : Une jeune fille meurt après avoir donné naissance à un bébé après avoir été violée par son propre père.

Au vu de ce qui s'est passé, les parents ont demandé l'aide du personnel du DIF pour effectuer les démarches nécessaires à l'enterrement de la petite fille, car ils ne disposent pas des ressources nécessaires, et ont demandé aux autres parents de ne pas commettre la même erreur d'automédication de leurs enfants.

Suivez-nous sur Instagram pour connaître les dernières nouvelles et les tendances de la semaine.","La grenouille arlequin, l'espèce qui sort de l'extinction","Pendant près de 30 ans, l'espèce de grenouille arlequin a été cachée à la science. Aujourd'hui, elle a refait surface.",États-Unis : une fillette de 6 ans meurt à cause de ses parents qui l'ont auto-médicamentée,"Une fillette de six ans a perdu la vie après que ses parents, par manque de ressources, ne se sont pas rendus chez le médecin et ont pratiqué l'automédication de la fillette.",4,4.0,0,0,0,[],[],-3.83,-4.86,-4.03,7.07,8.390000000000002,62.58000000000001,26.37,91.7,52.1
